year,no,instruction,input,result,isAnswerable,isMultipleChoice,isSingleChoiceSolution
2017,27,ข้อใดไม่ใช่ลักษณะของวัฒนธรรม ที่เกิดจากการผสมผสานทาง วัฒนธรรม (cultural assimilation) ระหว่างประชาชนใน ภูมิภาคอาเซียน,1. มีความสมบูรณ์เป็นสากล 2. มีการเปลี่ยนแปลง ไม่คงที่ 3. มีความหลากหลาย แตกต่างกัน 4. มีลักษณะเป็นสิ่งประดิษฐ์ทางสังคม 5. มีการไหลเวียนแลกเปลี่ยนระหว่างสังคม,1. มีความสมบูรณ์เป็นสากล,TRUE,TRUE,TRUE
2017,28,ข้อใดเป็นพระราชอำนาจที่ไม่ปรากฏเป็นลายลักษณ์อักษรในรัฐธรรมนูญ,1. การพระราชทานคำปรึกษาแก่รัฐบาล 2. การพระราชทานเครื่องราชย์อิสริยาภรณ์ 3. การโปรดเกล้าฯ แต่งตั้งฐานันดรศักดิ์ 4. การโปรดเกล้าฯ แต่งตั้งองคมนตรี 5. การพระราชทานอภัยโทษ,1. การพระราชทานคำปรึกษาแก่รัฐบาล,TRUE,TRUE,TRUE
2017,29,ข้อใดจับคู่ระบบการเมืองการปกครองกับข้อด้อยของระบบนั้นไม่ถูกต้อง,1. ประชาธิปไตย กับ ปัญหาเสียงข้างมากไม่รับฟังเสียงข้างน้อย 2. เสรีนิยม กับ ปัญหาการขาดเสถียรภาพทางการเมือง 3. อนุรักษ์นิยม กับ ปัญหาการพัฒนาที่ล่าช้า 4. อำนาจนิยม กับ ปัญหาการขาดระเบียบและกติกาในสังคม 5. สังคมนิยม กับ ปัญหาการริดรอนเสรีภาพทางเศรษฐกิจ,4. อำนาจนิยม กับ ปัญหาการขาดระเบียบและกติกาในสังคม,TRUE,TRUE,TRUE
2017,30,ปรากฏการณ์โลกาภิวัตน์ทางเศรษฐกิจมีผลกระทบต่อรัฐในเรื่องต่าง ๆ ต่อไปนี้ ยกเว้นเรื่องใด,1. รัฐมีความสัมพันธ์กับตลาดในระดับโลกมากยิ่งขึ้น 2. ตลาดมีบทบาทมากยิ่งขึ้นในการสร้างสวัสดิการแทนที่รัฐ 3. เส้นแบ่งดินแดนที่แน่นอนของรัฐชาติคลายความสำคัญลง 4. ความเป็นอิสระและอำนาจอธิปไตยของรัฐมีเพิ่มขึ้นอย่างมีนัยสำคัญ 5. รัฐลดบทบาทความสำคัญในฐานะตัวกระทำทางการเมืองระหว่างประเทศ,4. ความเป็นอิสระและอำนาจอธิปไตยของรัฐมีเพิ่มขึ้นอย่างมีนัยสำคัญ,TRUE,TRUE,TRUE
2017,31,ภายใต้ปัญหาความขัดแย้งทางการเมืองในหมู่ประชาชนในระยะกว่า10ปี ที่ผ่านมาของไทย ข้อใดไม่ใช่แนวทางเสริมสร้างประชาธิปไตยไทย ให้มั่นคง,1. บ่มเพาะประชาชนใช้หลักเหตุผลเป็นพื้นฐานในการตัดสินใจทางการเมือง 2. มีกฎหมายที่ยอมรับสิทธิในการดำเนินกิจกรรมทางการเมืองของประชาชน 3. ลดความเหลื่อมล้ำทางอำนาจระหว่างชนชั้นปกครองและประชาชน 4. ขจัดความคิดเห็นทางการเมืองที่แตกต่างกันในหมู่ประชาชน 5. สร้างความเชื่อมั่นต่อกติกาประชาธิปไตยในหมู่ประชาชน,4. ขจัดความคิดเห็นทางการเมืองที่แตกต่าง กันในหมู่ประชาชน,TRUE,TRUE,TRUE
2017,32,ระบอบเสรีประชาธิปไตยมีลักษณะสำคัญดังต่อไปนี้ ยกเว้นข้อใด,1. กองทัพมีบทบาทสำคัญในการประกันเสถียรภาพของรัฐบาลจากการเลือกตั้ง 2. ลดอำนาจรัฐ เพิ่มอำนาจและการมีส่วนร่วมของประชาชน 3. ตัวกระทำทางการเมืองยอมรับกฎกติกาประชาธิปไตย 4. ให้เสรีภาพพลเมืองและสิทธิทางการเมืองในระดับสูง 5. ใช้กฎหมายเป็นเครื่องมือในการปกครอง,1. กองทัพมีบทบาทสำคัญในการประกันเสถียรภาพของรัฐบาลจากการเลือกตั้ง,TRUE,TRUE,TRUE
2017,33,ข้อใดไม่จัดว่าเป็นปัจจัยทุน(capital) หรือสินค้าทุนตามความหมายทางเศรษฐศาสตร์,1. เงินทุน 2. รถบรรทุก 3. อาคารสำนักงาน 4. เครื่องคอมพิวเตอร์ 5. สัตว์ที่เลี้ยงไว้ใช้งาน,1. เงินทุน,TRUE,TRUE,TRUE
2017,34,ข้อใดเป็นข้อดีของระบบเศรษฐกิจแบบวางแผนจากส่วนกลางหรือสังคมนิยม เมื่อเปรียบเทียบกับระบบเศรษฐกิจแบบอื่น ๆ,1. การจัดสรรทรัพยากรเป็นไปอย่างมีประสิทธิภาพมากกว่า 2. การกระจายรายได้และทรัพย์สินมีความเท่าเทียมกันมากกว่า 3. เอกชนมีเสรีภาพในการดำเนินกิจกรรมทางเศรษฐกิจมากกว่า 4. ตลาดไม่ล้มเหลว เพราะกลไกราคาทำงานได้อย่างมีประสิทธิภาพมากกว่า 5. การตัดสินใจจากส่วนกลางหรือรัฐบาลมีความถูกต้องและแม่นยำมากกว่า,2. การกระจายรายได้และทรัพย์สินมี ความเท่าเทียมกันมากกว่า,TRUE,TRUE,TRUE
2017,35,ถ้าน้ำมันเบนซินและแก๊สโซฮอล์สามารถใช้ทดแทนกันได้ เมื่อราคาน้ำมันเบนซินลดลง ในขณะที่ราคาของแก๊สโซฮอล์ยังคงเดิม จะเกิดผลตามข้อใด,1. อุปทานของแก๊สโซฮอล์จะลดลง (เส้นอุปทานของแก๊สโซฮอล์เคลื่อนไปทางซ้าย) 2. อุปทานของน้ำมันเบนซินจะลดลง (เส้นอุปทานของน้ำมันเบนซินเคลื่อนไปทางซ้าย) 3. อุปสงค์สำหรับแก๊สโซฮอล์จะลดลง (เส้นอุปสงค์สำหรับแก๊สโซฮอล์เคลื่อนไปทางซ้าย) 4. อุปสงค์สำหรับแก๊สโซฮอล์จะเพิ่มขึ้น (เส้นอุปสงค์สำหรับแก๊สโซฮอล์เคลื่อนไปทางขวา) 5. อุปสงค์สำหรับน้ำมันเบนซินจะเพิ่มขึ้น (เส้นอุปสงค์สำหรับน้ำมันเบนซินเคลื่อนไปทางขวา),3. อุปสงค์สำหรับแก๊สโซฮอล์จะลดลง (เส้นอุปสงค์สำหรับแก๊สโซฮอล์เคลื่อนไปทางซ้าย),TRUE,TRUE,TRUE
2017,36,ในกรณีที่อุปทานของสินค้าลดลง แต่อุปสงค์สำหรับสินค้ายังคงเดิม จะส่งผลต่อการเปลี่ยนแปลงในราคาและปริมาณดุลยภาพของตลาดสินค้านั้นอย่างไร,1. ราคาดุลยภาพจะลดลง และปริมาณดุลยภาพลดลง 2. ราคาดุลยภาพจะเพิ่มขึ้น และปริมาณดุลยภาพเพิ่มขึ้น 3. ราคาดุลยภาพจะลดลง แต่ปริมาณดุลยภาพเพิ่มขึ้น 4. ราคาดุลยภาพจะเพิ่มขึ้น แต่ปริมาณดุลยภาพจะลดลง 5. ราคาดุลยภาพจะคงเดิม แต่ปริมาณดุลยภาพลดลง,4. ราคาดุลยภาพจะเพิ่มขึ้น แต่ปริมาณดุลยภาพจะลดลง,TRUE,TRUE,TRUE
2017,37,ถ้าตลาดสินค้าชนิดหนึ่งเป็นไปตามกฎของอุปสงค์และอุปทานแล้ว ปรากฏการณ์ตามข้อใดไม่ใช่ผลที่เกิดจากการกําหนดราคาขั้นสูงในตลาดสินค้าชนิดนั้นโดยรัฐบาล,1. สินค้าในตลาดจะเกิดภาวะความขาดแคลนขึ้น 2. ผู้ผลิตจะผลิตสินค้าออกขายในปริมาณที่น้อยลง 3. ผู้ซื้อจะมีความต้องการซื้อสินค้าในปริมาณที่มากขึ้นกว่าเดิม 4. ราคาสินค้าที่ซื้อขายกันตามกฎหมายจะต่ำกว่าราคาก่อนการกำหนดราคาขั้นสูง 5. ปริมาณการซื้อขายกันจริงๆ จะมากกว่าปริมาณซื้อขายก่อนการกำหนดราคาขั้นสูง,5. ปริมาณการซื้อขายกันจริงๆ จะมากกว่าปริมาณซื้อขายก่อนการกำหนดราคาขั้นสูง,TRUE,TRUE,TRUE
2017,38,ในสถานการณ์ใดที่ตลาดผูกขาดอาจส่งผลดีต่อระบบเศรษฐกิจและสังคมส่วนรวมมากกว่าตลาดประเภทอื่น ๆ,1. สินค้าที่ผลิตเป็นสินค้าที่จำเป็นต่อการครองชีพ 2. การผลิตสินค้านั้นก่อให้เกิดการประหยัดจากขนาด 3. การผลิตสินค้าชนิดนั้นก่อผลกระทบเชิงลบต่อสิ่งแวดล้อม 4. ผู้บริโภคในตลาดต่างก็มีความต้องการสินค้าในปริมาณมากๆ 5. สังคมต้องการให้การผลิตสินค้ามีประสิทธิภาพทางเศรษฐกิจสูงสุด,2. การผลิตสินค้านั้นก่อให้เกิดการประหยัดจากขนาด,TRUE,TRUE,TRUE
2017,39,การจัดสรรที่ดินทำกินให้กับสมาชิกที่เป็นเกษตรกรเป็นบทบาทสำคัญของสหกรณ์ประเภทใด,1. สหกรณ์นิคม 2. สหกรณ์บริการ 3. สหกรณ์ประมง 4. สหกรณ์การเกษตร 5. สหกรณ์เครดิตยูเนียน,1. สหกรณ์นิคม,TRUE,TRUE,TRUE
2017,40,แผนพัฒนาเศรษฐกิจและสังคมแห่งชาติฉบับใดของไทย ที่ได้อัญเชิญ ปรัชญาเศรษฐกิจพอเพียงมาใช้เป็นแนวทางการพัฒนาและ บริหารประเทศ โดยได้ระบุไว้ในแผนอย่างชัดเจนเป็นครั้งแรก,1. ฉบับที่ 7 3. ฉบับที่ 9 2. ฉบับที่ 8 4. ฉบับที่ 10 5. ฉบับที่ 11,3. ฉบับที่ 9,TRUE,TRUE,TRUE
2017,41,กำหนดให้ ผลิตภัณฑ์มวลรวมในประเทศ (GDP) 300 ล้านบาท รายได้สุทธิจากต่างประเทศ ~40 ล้านบาท ค่าเสื่อมราคา 10 ล้านบาท ภาษีทางอ้อม 30 ล้านบาท เงินอุดหนุน 10 ล้านบาท จํานวนประชากร 3 ล้านคน จากสถานการณ์ข้างต้น จงคำนวณผลิตภัณฑ์มวลรวมประชาชาติ (GNP),1. 100 ล้านบาท 2. 230 ล้านบาท 3. 250 ล้านบาท 4. 260 ล้านบาท 5. 290 ล้านบาท,4. 260 ล้านบาท,TRUE,TRUE,TRUE
2017,42,ข้อใดหมายถึงปริมาณเงินตามความหมายแคบ,1. เหรียญกษาปณ์ ธนบัตร เงินฝากประจำ หุ้นกู้ 2. ธนบัตร เงินฝากกระแสรายวัน เงินฝากประจำ 3. เหรียญกษาปณ์ ธนบัตร เงินฝากกระแสรายวัน 4. ธนบัตร เงินฝากกระแสรายวัน เงินฝากประจำ พันธบัตรรัฐบาล 5. ธนบัตร เงินฝากกระแสรายวัน เงินฝากออมทรัพย์ เงินฝากประจำ,3. เหรียญกษาปณ์ ธนบัตร เงินฝากกระแสรายวัน,TRUE,TRUE,TRUE
2017,43,“ครอบครัวชาวนามีสมาชิกที่อยู่ในวัยทำงาน 9 คน ช่วยกันปลูกข้าวใน ที่นาของตน ได้ข้าวปีละ 12 เกวียน ต่อมาสมาชิกในครอบครัว 2 คน แต่งงานและย้ายภูมิลำเนาไปอยู่จังหวัดอื่น ทําให้เหลือสมาชิกใน ครอบครัวที่คงทำการปลูกข้าวเพียง 7 คน แต่ก็ยังคงได้ข้าวปีละ12เกวียน เท่าเดิม” จากข้อความดังกล่าวเป็นประเภทของการว่างงานในข้อใด,1. การว่างงานแฝง 2. การว่างงานชั่วคราว 3. การว่างงานตามฤดูกาล 4. การว่างงานเนื่องจากวัฏจักรธุรกิจ 5. การว่างงานเนื่องจากโครงสร้างของระบบเศรษฐกิจ,1. การว่างงานแฝง,TRUE,TRUE,TRUE
2017,44,รัฐบาลควรใช้นโยบายงบประมาณขาดดุลในกรณีที่เศรษฐกิจของประเทศอยู่ในภาวะใดมากที่สุด,1. เงินเฟ้อ 2. เศรษฐกิจปกติ 3. เศรษฐกิจตกต่ำ 4. เศรษฐกิจขยายตัว 5. ราคาสินค้าเพิ่มสูงขึ้นอย่างรวดเร็วและต่อเนื่อง,3. เศรษฐกิจตกต่ำ,TRUE,TRUE,TRUE
2017,45,ข้อใดถูกต้องเกี่ยวกับการใช้เครื่องมือของนโยบายการเงิน ในกรณีที่ประเทศเกิดปัญหาภาวะเงินฝืด,1. รัฐบาลลดการใช้จ่ายลง 2. รัฐบาลเพิ่มการเก็บภาษี 3. รัฐบาลใช้งบประมาณเกินดุล 4. ธนาคารกลางขายหลักทรัพย์ของรัฐบาล 5. ธนาคารกลางลดอัตราเงินสำรองตามกฎหมาย,5. ธนาคารกลางลดอัตราเงินสำรองตามกฎหมาย,TRUE,TRUE,TRUE
2017,46,ข้อใดเป็นการลงทุนทางตรงระหว่างประเทศ,1. นางเมตตานำเงินของบริษัทไปฝากในต่างประเทศ 2. คนญี่ปุ่นนำเงินทุนเข้ามาสร้างโรงงานทอผ้าในไทย 3. คนมาเลเซียนำเงินทุนไปซื้อหลักทรัพย์ของรัฐบาลไทย 4. บริษัทของนางสาวกรุณากู้ยืมเงินจากสถาบันการเงินในต่างประเทศ 5. บริษัทของนายมัธยัสถ์ให้สินเชื่อทางการค้ากับบริษัทคู่ค้าในต่างประเทศ,2. คนญี่ปุ่นนำเงินทุนเข้ามาสร้างโรงงาน ทอผ้าในไทย,TRUE,TRUE,TRUE
2017,47,กลุ่มประเทศตามข้อใดต่อไปนี้เป็นสมาชิกของสมาคมประชาชาติ แห่งเอเชียตะวันออกเฉียงใต้ (อาเซียน),1. ไทย เวียดนาม ลาว เมียนมา กัมพูชา 2. ไทย เวียดนาม ฟิลิปปินส์ จีน สิงคโปร์ 3. ไทย มาเลเซีย ฟิลิปปินส์ สิงคโปร์ ญี่ปุ่น 4. ไทย มาเลเซีย อินโดนีเซีย อินเดีย สิงคโปร์ 5. ไทย มาเลเซีย อินโดนีเซีย บรูไนดารุสซาลาม เกาหลีใต้,1. ไทย เวียดนาม ลาว เมียนมา กัมพูชา,TRUE,TRUE,TRUE
2017,48,ข้อใดเป็นการรวมกลุ่มทางการค้าที่มีการยกเลิกภาษีศุลกากรและข้อจำกัด ทางการค้าระหว่างกันในกลุ่มมีการใช้ข้อกำหนดอัตราภาษีศุลกากรกับ ประเทศคู่ค้านอกกลุ่มในอัตราเดียวกัน มีการเคลื่อนย้ายปัจจัยการผลิตได้ โดยเสรีระหว่างประเทศสมาชิกด้วยกัน และประเทศสมาชิกกำหนดนโยบาย ด้านเศรษฐกิจต่างๆ เป็นรูปแบบเดียวกัน,1. ตลาดร่วม 2. เขตการค้าเสรี 3. สหภาพศุลกากร 4. สหภาพเศรษฐกิจ 5. สหภาพการเมือง,4. สหภาพเศรษฐกิจ,TRUE,TRUE,TRUE
2017,49,ข้อใดกล่าวไม่ถูกต้อง,1. พวกฮิตไทต์ (Hittites) ในเมโสโปเตเมีย รู้จักการถลุงเหล็กเพื่อทําเป็นอาวุธในยุคโลหะ 2. ศิลปะแบบเมกกาเลเนียน (Magalemian) คือภาพวาดตามผนังถ้ำ และภาพแกะสลักบนกระดูกเป็นศิลปะที่มีชื่อเสียงของยุคหินเก่า 3. มนุษย์ในยุคหินใหม่เริ่มรู้จักการเพาะปลูกและเลี้ยงสัตว์ 4. นักโบราณคดีใช้วิธีเทอร์โมลูมิเนเซนท์ (thermoluminescence) ในการหาอายุของซากไม้ และโครงกระดูกมนุษย์ 5. ตัวอักษรลิ่ม หรือตัวอักษรคูนิฟอร์ม เป็นตัวอักษรที่ชาวสุเมเรียนคิดค้นขึ้น,4. นักโบราณคดีใช้วิธีเทอร์โมลูมิเนเซนท์ (thermoluminescence) ในการหาอายุ ของซากไม้ และโครงกระดูกมนุษย์,TRUE,TRUE,TRUE
