year,no,instruction,input,result,isAnswerable,isMultipleChoice,isSingleChoiceSolution
2019,55,ข้อใดไม่ใช่ลักษณะของสังคมในยุคหินใหม่,1. การดํารงชีวิตอยู่ในสภาพวิถีชีวิตแบบชุมชนเมือง 2. มนุษย์ตั้งถิ่นฐานเป็นหลักแหล่ง ไม่อพยพเคลื่อนย้าย 3. มนุษย์รู้จักการเกษตรกรรมคือการเพาะปลูกและเลี้ยงสัตว์ 4. ประดิษฐ์ลวดลายลงบนเครื่องปั้นดินเผา ไม่นิยมวาดภาพตามผนังถ้ำ 5. เครื่องมือเครื่องใช้ที่เป็นหินมีความแหลมคม เพิ่มประโยชน์ใช้สอยมากขึ้น,1. การดำรงชีวิตอยู่ในสภาพวิถีชีวิตแบบ ชุมชนเมือง,TRUE,TRUE,TRUE
2019,56,ข้อใดกล่าวถูกต้องเกี่ยวกับอารยธรรมอินเดีย,1. คัมภีร์พระเวทถือเป็นวรรณกรรมสำคัญของอินเดีย 2. อินเดียมีความแตกต่างของกลุ่มชาติพันธุ์น้อยกว่าจีน 3. ศิลปะแบบคันธารราฐคือการปั้นพระพุทธรูปในสมัยราชวงศ์คุปตะ 4. สมัยราชวงศ์เมารยะถือเป็นยุคทองของอินเดียด้านศิลปวัฒนธรรม 5. การแต่งงานข้ามวรรณะของอินเดียถือเป็นเรื่องที่ได้รับการยอมรับ,1. คัมภีร์พระเวทถือเป็นวรรณกรรมสำคัญของอินเดีย,TRUE,TRUE,TRUE
2019,57,ข้อใดต่อไปนี้กล่าวถูกต้อง,1. ชนเผ่าต่าง ๆ ในอารยธรรมเมโสโปเตเมียมักมีการปกครองในรูปแบบของนครรัฐ 2. ชาวอียิปต์โบราณมีความเชื่อเรื่องอมตะภาวะของผู้วายชนม์ทั้งที่เป็นฟาโรห์ลงมาถึงสามัญชน 3. พระจักรพรรดิคอนสแตนตินทรงประกาศให้คริสต์ศาสนาเป็นศาสนาทางการแห่งจักรวรรดิโรมัน 4. จุดประสงค์ของการแข่งขันกีฬาโอลิมปิกของกรีกยุคโบราณคล้ายคลึงกับการแข่งขันกีฬาโอลิมปิกในปัจจุบัน 5. พระเจ้าอเล็กซานเดอร์มหาราชมีบทบาทสำคัญในการทำให้อารยธรรมกรีก แพร่กระจายทั่วไปในแถบทะเลเมดิเตอร์เรเนียนเป็นครั้งแรก,2. ชาวอียิปต์โบราณมีความเชื่อเรื่องอมตะ ภาวะของผู้วายชนม์ทั้งที่เป็นฟาโรห์ลง,TRUE,TRUE,TRUE
2019,58,ข้อใดกล่าวถูกต้องเกี่ยวกับแนวคิดมนุษยนิยม (Humanism) ในสมัยการฟื้นฟูศิลปวิทยาการของยุโรป,1. ความสนใจศึกษาและลอกเลียนแบบองค์ความรู้และสุนทรียะทางภาษาจากอารยธรรมคลาสสิค 2. ศิลปินแนวมนุษยนิยมมักผลิตผลงานที่สะท้อนความจริงของสังคมเป็นสำคัญมากกว่ามิติทางศาสนา 3. นักมนุษยนิยมคริสเตียนให้ความสำคัญต่องานเขียนที่เกี่ยวข้องกับคริสต์ศาสนาและงานเขียนของกวีโรมัน 4. การศีกษาปรัชญายุคคลาสสิคเพื่อเป็นแนวทางในการดำเนินชีวิตและแก้ปัญหาสังคมและการเมืองในสมัยดังกล่าว 5. การใช้เหตุผลเพื่อแสดงทัศนะทางสังคมและการเมืองและเชื่อว่าเหตุผลสามารถเปลี่ยนชีวิตและสังคมให้ดีขึ้นได้,4. การศีกษาปรัชญายุคคลาสสิคเพื่อเป็นแนวทางในการดำเนินชีวิตและแก้ปัญหา สังคมและการเมืองในสมัยดังกล่าว,TRUE,TRUE,TRUE
2019,59,ข้อใดต่อไปนี้ไม่ใช่ผลของการปฏิรูปคริสต์ศาสนาในสมัยคริสต์ศตวรรษที่ 16 - 17,1. เกิดความขัดแย้งทั้งทางการเมืองและศาสนาทั่วทั้งทวีปยุโรปในรูปแบบของสงคราม 2. เกิดกระแสแนวคิดชาตินิยมแบบคลั่งชาติทั่วไปในดินแดนที่นับถือนิกายโปรเตสแตนต์ 3. เกิดการประชุมสภาสงฆ์ ณ เมืองเทรนต์ และมีการกำหนดรายชื่อหนังสือต้องห้ามสำหรับฝ่ายคาทอลิก 4. การสถาปนาคณะสงฆ์เยซูอิตของฝ่ายคาทอลิกเพื่อการศึกษาและการเผยแผ่ศาสนาในดินแดนโพ้นทะเล 5. การเพิ่มขึ้นอย่างมีนัยสำคัญของจำนวนประชากรผู้สามารถอ่านออกเขียนได้ในดินแดนโปรเตสแตนต์,2. เกิดกระแสแนวคิดชาตินิยมแบบคลั่งชาติ ทั่วไปในดินแดนที่นับถือนิกายโปรเตสแตนต์,TRUE,TRUE,TRUE
2019,60,ข้อใดต่อไปนี้ไม่ใช่สาเหตุที่ทำให้อังกฤษประสบความสำเร็จในการปฏิวัติอุตสาหกรรมเป็นชาติแรก,1. เจ้าของโรงงานอุตสาหกรรมในระยะแรกมีศรัทธาในเรื่องชะตากรรมของมนุษย์ว่าถูกกำหนดไว้แล้วโดยพระเป็นเจ้า 2. อังกฤษมีแหล่งทรัพยากรอันจำเป็นแก่การพัฒนาอุตสาหกรรมโดยเฉพาะถ่านหินที่อยู่ภายในประเทศเป็นจำนวนมาก 3. การเพิ่มขึ้นของประชากรทั้งในส่วนของตลาดแรงงานราคาถูกและในส่วนของตลาดผู้บริโภคสินค้าที่มีอัตรากำลังซื้อสูง 4. ความสามารถของนักประดิษฐ์ชาวอังกฤษในการคิดค้นนวัตกรรมเครื่องจักรไอน้ำและนำมาประยุกต์ใช้ในอุตสาหกรรมทอผ้า 5. รัฐสภาและรัฐบาลอังกฤษไม่ยุ่งเกี่ยวกับกิจการการค้าทั้งภายในและระหว่างประเทศปล่อยให้เอกชนดำเนินกิจการกันไปเองตามหลักการเสรีนิยม,5. รัฐสภาและรัฐบาลอังกฤษไม่ยุ่งเกี่ยวกับ กิจการการค้าทั้งภายในและระหว่างประเทศปล่อยให้เอกชนดำเนินกิจการกันไปเองตามหลักการเสรีนิยม,TRUE,TRUE,TRUE
2019,61,ข้อใดต่อไปนี้ไม่สัมพันธ์กัน,1. การฟื้นฟูศิลปวิทยาการในอิตาลี กับ การปฏิรูปคริสต์ศาสนาของมาร์ติน ลูเธอร์ 2. การค้นพบทวีปอเมริกาของโคลัมบัส กับ การลงนามสนธิสัญญาทอร์เดซิลาส 3. แนวคิด “ลัทธิสากลนิยม” กับ การสถาปนาองค์การสันนิบาตชาติ 4. แนวคิด “ภาระหน้าที่ของคนผิวขาว” กับ การฆ่าล้างเผ่าพันธุ์ชาวยิวของนาซีเยอรมนี 5. การผ่อนคลายความตึงเครียดช่วงสงครามเย็น กับ การประชุม ณ กรุงเฮลซิงกิ ค. ศ. 1975,4. แนวคิด “ภาระหน้าที่ของคนผิวขาว” กับ การฆ่าล้างเผ่าพันธุ์ชาวยิวของนาซีเยอรมนี,TRUE,TRUE,TRUE
2019,62,ข้อใดกล่าวไม่ถูกต้องเกี่ยวกับผลของระบอบอาณานิคมที่มีต่อเศรษฐกิจในเอเชียตะวันออกเฉียงใต้,1. เกิดการปลูกพืชชนิดใหม่ ๆ มากขึ้น 2. เกิดการพัฒนาที่ดินขยายการเพาะปลูก 3. เกิดการพัฒนาระบบการเงินการธนาคาร 4. ชาวจีนเข้ามาประกอบอาชีพในเอเชียตะวันออกเฉียงใต้น้อยลง 5. ระบบเศรษฐกิจเปลี่ยนเป็นระบบเศรษฐกิจที่ต้องพึ่งเศรษฐกิจโลก,4. ชาวจีนเข้ามาประกอบอาชีพใน เอเชียตะวันออกเฉียงใต้น้อยลง,TRUE,TRUE,TRUE
2019,63,ข้อใดกล่าวไม่ถูกต้องเกี่ยวกับการปฏิวัติจีน ค. ศ. 1911,1. ผู้นำในการปฏิวัติคือ ดร. ซุนยัดเซ็น 2. สาเหตุมาจากความเสื่อมของราชวงศ์ชิง 3. จีนปรับปรุงประเทศให้ทันสมัยตามแนวคิดลัทธิไตรราษฎร์ 4. การปฏิวัติสิ้นสุดลงด้วยการสละราชสมบัติของจักรพรรดิจีน 5. ทำให้จีนกลายเป็นประเทศที่ปกครองด้วยระบอบคอมมิวนิสต์,5. ทำให้จีนกลายเป็นประเทศที่ปกครองด้วย ระบอบคอมมิวนิสต์,TRUE,TRUE,TRUE
2019,64,ข้อใดกล่าวไม่ถูกต้องเกี่ยวกับสหภาพยุโรป,1. ทุกประเทศที่เป็นสมาชิกต้องใช้เงินสกุลยูโร 2. มุ่งให้เกิดการเคลื่อนย้ายคน สินค้า บริการและทุนอย่างเสรี 3. การเป็นยุโรปตลาดเดียวส่งเสริมความได้เปรียบในด้านต้นทุนการผลิตและขนส่ง 4. มีการประชุมสุดยอดของประมุขแห่งรัฐหรือหัวหน้ารัฐบาลอย่างน้อยปีละ 4 ครั้ง 5. ประเทศสหราชอาณาจักร คือ ประเทศล่าสุดที่ออกจากการเป็นสมาชิกภาพของ สหภาพยุโรป,1. ทุกประเทศที่เป็นสมาชิกต้องใช้เงินสกุลยูโร,TRUE,TRUE,TRUE
2019,65,แผนที่ชุด L7018 จัดเป็นแผนที่ประเภทใด,1. แผนที่เล่ม 2. แผนที่อ้างอิง 3. แผนที่ลายเส้น 4. แผนที่รูปถ่าย 5. แผนที่เฉพาะเรื่อง,2. แผนที่อ้างอิง,TRUE,TRUE,TRUE
2019,66,ข้อใดกล่าวถูกต้องเกี่ยวกับประโยชน์ของระบบกำหนดตำแหน่งบนพื้นโลกด้านการใช้ประโยชน์ที่ดิน,1. ติดตามตรวจสอบข้อมูลการเดินทางของยานพาหนะในเวลาจริง (real time) 2. คำนวณเส้นทาง นำทาง หาเส้นทางในระหว่างการขับขี่ยานพาหนะ 3. หาค่าพิกัดในการรังวัดพื้นที่ได้ละเอียดถึงระดับเซนติเมตร 4. ติดตามการเปลี่ยนแปลงของอากาศจากทิศทางของเมฆ 5. ประหยัดเวลาและค่าใช้จ่ายในการเดินทาง,3. หาค่าพิกัดในการรังวัดพื้นที่ได้ละเอียดถึง ระดับเซนติเมตร,TRUE,TRUE,TRUE
2019,67,ข้อใดไม่ใช่การป้องกันการสูญเสียหรือเฝ้าระวังภัยจากแผ่นดินถล่มที่ถูกต้อง,1. นักท่องเที่ยวหลีกเลี่ยงการไปเที่ยวบริเวณภูเขาในช่วงฤดูฝน 2. กรมป่าไม้ร่วมมือกับชุมชนจัดโครงการรณรงค์ปลูกป่าเพื่อฟื้นฟูป่าให้อุดมสมบูรณ์ 3. สถานที่พักตากอากาศเตรียมการก่อสร้างอาคารบนภูเขาด้วยการบดอัดดินบริเวณเนินเขาชันให้แน่น 4. ชาวบ้านที่อาศัยอยู่ในบริเวณภูเขาตั้งกลุ่มอาสาสมัครช่วยกันสังเกตระดับน้ำในแหล่งน้ำในช่วงที่ฝนตกหนัก 5. เจ้าหน้าที่อุทยานสังเกตเห็นน้ำตกมีน้ำสีแดงขุ่นจึงประกาศให้นักท่องเที่ยวรีบออกห่างจากพื้นที่ให้มากที่สุด,3. สถานที่พักตากอากาศเตรียมการก่อสร้างอาคารบนภูเขาด้วยการบดอัดดินบริเวณเนินเขาชันให้แน่น,TRUE,TRUE,TRUE
2019,68,ภูมิประเทศในข้อใดที่มีกระบวนการเกิดเหมือนกับหุบเขาทรุด (rift valley),1. แกรนด์แคนยอนในสหรัฐอเมริกา 2. ทะเลสาบทางตอนเหนือของแคนาดา 3. ทะเลสาบแทนแกนยิกาในประเทศคองโก 4. เนินทรายหรือสันทรายในเขตทะเลทรายซาฮารา 5. ทะเลสาบรูปแอกในภาคตะวันออกเฉียงเหนือของประเทศไทย,3. ทะเลสาบแทนแกนยิกาในประเทศคองโก,TRUE,TRUE,TRUE
2019,69,หากนักเรียนต้องการเดินทางไปท่องเที่ยวเมืองชายฝั่งที่อยู่ระหว่า อ่าวเบงกอลกับเมียนมา ควรหลีกเลี่ยงการเดินทางในช่วงเวลาใดเพื่อลดความเสี่ยงที่จะเจอกับภัยจากพายุหมุนเขตร้อน,1. มกราคม 2. กุมภาพันธ์ 3. มีนาคม 4. พฤษภาคม 5. ธันวาคม,4. พฤษภาคม,TRUE,TRUE,TRUE
2019,70,ข้อใดไม่ถูกต้องเกี่ยวกับปรากฏการณ์การเกิดช่องโหว่ของชั้นโอโซน,1. การสลายตัวของก๊าซโอโซน (O3) กลายเป็นก๊าซออกซิเจน (O2) 2. ระบบนิเวศทางทะเลเสียหายเนื่องจากสาหร่ายที่เป็นผู้ผลิตขั้นต้นตายมากขึ้น 3. การเผาไหม้เชื้อเพลิงจากฟอสซิลเป็นสาเหตุหลักที่ทำให้เกิดช่องโหว่ของชั้นโอโซน 4. การขยายตัวของช่องโหว่ทำให้ประชากรโลกมีความเสี่ยงต่อโรคมะเร็งผิวหนังมากขึ้น 5. ต้นไม้ได้รับรังสีอัลตราไวโอเลตมากจนเกินไปส่งผลต่อการเจริญเติบโตของพืชที่ช้าลง หรือทำให้พืชแคระแกร็นมากขึ้น,3. การเผาไหม้เชื้อเพลิงจากฟอสซิลเป็นสาเหตุหลักที่ทำให้เกิดช่องโหว่ของชั้นโอโซน,TRUE,TRUE,TRUE
2019,71,ข้อใดเป็นผลจากการเปลี่ยนแปลงภูมิอากาศของโลก,1. การขาดแคลนน้ำ และน้ำเสีย 2. การเพิ่มขึ้นของประชากร และปะการังฟอกสี 3. การขยายตัวของทะเลทราย และมลพิษทางอากาศ 4. การกัดเซาะพื้นที่ชายฝั่งทะเลรุนแรงขึ้น และการบุกรุกพื้นที่ป่า 5. การสูญเสียปะการังตามแนวชายฝั่งมหาสมุทรอินเดีย และการแพร่กระจายของเชื้อโรค,5. การสูญเสียปะการังตามแนวชายฝั่ง มหาสมุทรอินเดีย และการแพร่กระจายของเชื้อโรค,TRUE,TRUE,TRUE
2019,72,จากการพัฒนาประเทศให้มีความเจริญเติบโตทางเศรษฐกิจและอุตสาหกรรม ได้มีการนำทรัพยากรธรรมชาติและสิ่งแวดล้อมมาใช้ประโยชน์ทางเศรษฐกิจอย่างมากจนทรัพยากรธรรมชาติและสิ่งแวดล้อมเริ่มเสื่อมโทรม ข้อใดไม่ใช่สาเหตุที่ทำให้เกิดสถานการณ์การเสื่อมโทรมดังกล่าว,1. การเพิ่มขึ้นของทรัพยากรหมุนเวียน 2. การเพิ่มขึ้นของประชากรอย่างรวดเร็ว 3. การเพิ่มขึ้นของความขัดแย้งระหว่างประเทศ 4. การบริโภคสินค้าและบริการอย่างฟุ่มเฟือย 5. ความก้าวหน้าทางวิทยาศาสตร์และเทคโนโลยี,1. การเพิ่มขึ้นของทรัพยากรหมุนเวียน,TRUE,TRUE,TRUE
2019,73,วิกฤตการณ์ด้านทรัพยากรเกิดจากการกระทำของมนุษย์ และส่งผลกระทบต่อคุณภาพชีวิตของมนุษย์รวมถึงการพัฒนาเศรษฐกิจและสังคมของประเทศ เนื่องจากวิกฤตการณ์นี้ส่งผลเสียต่อมนุษย์ เหตุใดมนุษย์จึงยังคงกระทำให้เกิดวิกฤตการณ์ดังกล่าว,1. มนุษย์ไม่รู้ว่าสิ่งที่กำลังกระทำ ก่อให้เกิดวิกฤตการณ์ดังกล่าว 2. มนุษย์เชื่อว่าธรรมชาติจะปรับสภาพแวดล้อมเข้าสู่สมดุลในที่สุด 3. มนุษย์คิดว่าทรัพยากรบนโลกนี้มีอยู่มากมาย เพียงพอที่จะสนับสนุนชีวิตความเป็นอยู่ของมนุษย์ได้ 4. มนุษย์มีความหลงใหลในวัตถุมากกว่าคุณธรรมและจริยธรรม มีความต้องการที่ฟุ้งเฟ้อในสิ่งที่ไม่จำเป็น 5. มนุษย์เชื่อว่าการกระทำของมนุษย์ไม่ใช่สาเหตุหลักที่ทำให้เกิดวิกฤตการณ์ด้านทรัพยากรและสิ่งแวดล้อม,4. มนุษย์มีความหลงใหลในวัตถุมากกว่า คุณธรรมและจริยธรรม มีความต้องการที่ฟุ้งเฟ้อในสิ่งที่ไม่จำเป็น,TRUE,TRUE,TRUE
