year,no,instruction,input,result,isAnswerable,isMultipleChoice,isSingleChoiceSolution
2016,1,เรื่องใดที่ศาสนาพุทธและศาสนาพราหมณ์-ฮินดูมีความเชื่อร่วมกัน,1. อาตมัน 2. พรหมลิขิต 3. สังสารวัฏ 4. การนับถือเทพเจ้า 5. กรรมลิขิต,3. สังสารวัฏ,TRUE,TRUE,TRUE
2016,2,เหตุการณ์ใดไม่ได้เกิดขึ้นในวันอาสาฬหบูชา,1. พระโกณฑัญญะได้ดวงตาเห็นธรรม 2. พระรัตนตรัยครบสมบูรณ์ 3. พระพุทธเจ้าทรงแสดงธัมมจักกัปปวัตนสูตร 4. พระพุทธเจ้าทรงแสดงโอวาทปาฏิโมกข์ 5. เป็นวันเกิดพระอริยสงฆ์ขึ้นเป็นครั้งแรกในโลก,4. พระพุทธเจ้าทรงแสดงธัมมจักกัปปวัตสูตร,TRUE,TRUE,TRUE
2016,3,สำนวนข้อใดตรงกับความหมายของสัมมาทิฏฐิ,1. คนดีตกน้ำไม่ไหล 2. ไม่เชื่ออย่าลบหลู่ 3. คนรวยทำอะไรก็ไม่น่าเกลียด 4. สถานการณ์สร้างวีรบุรุษ 5. มีเงินเขานับว่าน้อง,1. คนดีตกน้ำไม่ไหล,TRUE,TRUE,TRUE
2016,4,พิธีที่ชาวคริสต์นิกายโรมันคาทอลิกกินขนมปังและดื่มเหล้าองุ่น ที่บาทหลวงส่งให้เรียกว่าพิธีอะไร,1. ศีลกำลัง 2. ศีลล้างบาป 3. ศีลแก้บาป 4. ศีลมหาสนิท 5. ศีลเจิมผู้ป่วย,4. ศีลมหาสนิท,TRUE,TRUE,TRUE
2016,5,ในการละหมาด ชาวมุสลิมในประเทศไทยจะต้องทำอย่างไร,1. ต้องกระทำอย่างน้อยวันละ 2 เวลา 2. ต้องกระทำตั้งแต่จำความได้เป็นต้นไป 3. ต้องกระทำโดยหันหน้าไปทางทิศตะวันตก 4. ต้องกระทำในมัสยิดหรือศาสนสถานเท่านั้น 5. ต้องกระทำโดยหันหน้าไปทางทิศตะวันออก,3. ต้องกระทำโดยหันหน้าไปทางทิศตะวันตก,TRUE,TRUE,TRUE
2016,6,ความเชื่อของชาวมุสลิมข้อใดที่ใกล้เคียงกับเรื่องกรรมในศาสนาพุทธ,1. ศรัทธาในศาสนทูตและเทวทูต 2. ศรัทธาในกฎสภาวะของพระเจ้า 3. ศรัทธาในวันพิพากษา 4. ศรัทธาในการละหมาด 5. ศรัทธาในเทพเจ้า,3. ศรัทธาในวันพิพากษา,TRUE,TRUE,TRUE
2016,7,คณะนักเรียนควรนำหลักธรรมใดไปประยุกต์ใช้ในการทำงาน ส่วนรวมเพื่อให้เกิดผลสำเร็จอันเป็นประโยชน์ร่วมกัน,1. อุปาสักธรรม 2. ปัญญาวุฒิธรรม 3. อปริหานิยธรรม 4. อริยวัฑฒิธรรม 5. ทิฏฐธัมมิกัตถสังวัตตนิกธรรม,3. อปริหานิยธรรม,TRUE,TRUE,TRUE
2016,8,“คิ้วเห็นเด็กชายต้นหน้าตาน่ารักอยากเข้าไปอุ้ม” ข้อความนี้สอดคล้องกับข้อใด,1. รูป เวทนา 2. รูป เวทนา สัญญา 3. รูป สัญญา สังขาร 4. รูป เวทนา สัญญา สังขาร 5. รูป เวทนา สัญญา สังขาร วิญญาณ,5. รูป เวทนา สัญญา สังขาร วิญญาณ,TRUE,TRUE,TRUE
2016,9,การที่รัฐบาลพยายามแก้ปัญหาการทุจริตฉ้อราษฎร์บังหลวง จัดอยู่ในอริยสัจ 4 ข้อใด,1. ทุกข์ 2. สมุทัย 3. นิโรธ 4. มรรค 5. ทุกข์และสมุทัย,4. มรรค,TRUE,TRUE,TRUE
2016,10,“เป็นคนควรพยายามจนกว่าจะประสบความสำเร็จ” เป็นคำแปลของภาษาบาลีในข้อใด,1. วิริเยน ทุกขมจุเจติ 2. โกธ ฆตวา สุข เสติ 3. ราชานํ มุข มนุสฺสานํ 4. วายเมเถว ปุริโส ยาว อตฺถสฺส นิปฺปทา 5. ปฏิรูปการี ธุรวา อุฏฺฐาตา วินทเต ธน์,4. วายเมเถว ปุริโส ยาว อตฺถสฺส นิปฺปทา,TRUE,TRUE,TRUE
2016,11,วันสำคัญทางพระพุทธศาสนาที่องค์การสหประชาชาติ ประกาศรับรองให้เป็น “วันสำคัญสากล” คือวันใด,1. วันมาฆบูชา 2. วันอัฏฐมีบูชา 3. วันวิสาขบูชา 4. วันอาสาฬหบูชา 5. วันจาตุรงคสันนิบาต,3. วันวิสาขบูชา,TRUE,TRUE,TRUE
2016,12,นุชนภาไปชมคอนเสิร์ตกับเพื่อน ๆ เธอมีความสุขมาก ข้อความนี้สอดคล้องกับข้อใด,1. จักขุวิญญาณ ฆานวิญญาณ 2. ฆานวิญญาณ กายวิญญาณ 3. กายวิญญาณ มโนวิญญาณ 4. จักขุวิญญาณ โสตวิญญาณ ชิวหาวิญญาณ 5. จักขุวิญญาณ โสตวิญญาณ มโนวิญญาณ,5. จักขุวิญญาณ โสตวิญญาณ มโนวิญญาณ,TRUE,TRUE,TRUE
2016,13,"""ถึงแม้ว่าอ๊อดจะร้องเพลงไม่เพราะ แต่เพื่อน ๆ ของอ๊อดก็ตั้งใจฟัง และให้กำลังใจอ๊อดจนร้องเพลงจบ"" ข้อความนี้สอดคล้องกับข้อใด",1. เนกขัมมวิตก 2. พยาบาทวิตก 3. กามวิตก 4. วิหิงสาวิตก 5. อวิหิงสาวิตก,5. อวิหิงสาวิตก,TRUE,TRUE,TRUE
2016,14,โต เป็นผู้ที่มีสุขภาพแข็งแรงเพราะเขาออกกำลังกายอย่าง สม่ำเสมอและเขายังแนะนำให้เพื่อน ๆ รู้จักออกกำลังกายด้วย การกระทำของโตสอดคล้องกับข้อใด,1. กายภาวนา ศีลภาวนา 2. ศีลภาวนา จิตตภาวนา 3. กายภาวนา จิตตภาวนา 4. กายภาวนา ศีลภาวนา ปัญญาภาวนา 5. กายภาวนา จิตตภาวนา ปัญญาภาวนา,4. กายภาวนา ศีลภาวนา ปัญญาภาวนา,TRUE,TRUE,TRUE
2016,15,พระปัญจวัคคีย์องค์ใดมีคุณลักษณะเด่นเป็นผู้อ่อนน้อมถ่อมตน,1. พระอัญญาโกณฑัญญะ 2. พระวัปปะ 3. พระภัททิยะ 4. พระมหานามะ 5. พระอัสสชิ,5. พระอัสสชิ,TRUE,TRUE,TRUE
2016,16,ผู้ที่ต่อสู้กับระบบวรรณะในอินเดียจนกลายเป็นชาวพุทธตัวอย่างคือใคร,1. มหาตมคานธี 2. พระนาคเสน 3. พระยามิลินท์ 4. ดร. เอ็มเบดการ์ 5. อนาคาริกธรรมปาละ,4. ดร. เอ็มเบดการ์,TRUE,TRUE,TRUE
2016,17,บุคคลใดไม่ใช่บุตรชอบด้วยกฎหมายของฝ่ายชาย,1. นายดําเป็นลูกที่เกิดจากนายแดงและนางขาวซึ่งจดทะเบียนสมรสกัน แล้วต่อมานายแดงและนางขาวหย่ากัน 2. นายเอเป็นลูกที่เกิดจากนางบีและนายซีซึ่งอยู่กินกันโดยไม่ได้จดทะเบียนสมรส แต่ต่อมานายซีจดทะเบียนรับรองว่าเป็นบุตร 3. นายแก้วเป็นลูกที่เกิดจากนางถ้วยและนายโถซึ่งอยู่กินกันโดยไม่ได้จดทะเบียนสมรส แต่ต่อมานางถ้วยและนายโถได้จดทะเบียนสมรสกัน 4. นายองุ่นเป็นลูกที่เกิดจากนางส้มและนายฝรั่งซึ่งอยู่กินกันโดยไม่ได้จดทะเบียนสมรส แต่นายฝรั่งได้มีการรับรองโดยพฤติการณ์กับบุคคลทั่วไปว่าเป็นบุตรของตนมาโดยตลอด เช่น ให้นายองุ่นใช้นามสกุลของนายฝรั่ง นายฝรั่งส่งเสียอุปการะเลี้ยงดู เป็นต้น 5. ศาลมีคำพิพากษาว่านายกิ่งลูกนางใบเป็นบุตรของนายก้าน โดยที่นายก้านกับนางใบไม่เคยจดทะเบียนสมรสกัน,4. นายองุ่นเป็นลูกที่เกิดจากนางส้มและ นายฝรั่งซึ่งอยู่กินกันโดยไม่ได้จดทะเบียนสมรส แต่นายฝรั่งได้มีการรับรองโดยพฤติการณ์กับบุคคลทั่วไปว่าเป็นบุตรของตนมาโดยตลอด เช่น ให้นายองุ่นใช้นามสกุลของนายฝรั่ง นายฝรั่งส่งเสียอุปการะ เลี้ยงดู เป็นต้น,TRUE,TRUE,TRUE
2016,18,ข้อใดกล่าวถึงเรื่องรับบุตรบุญธรรมไม่ถูกต้อง,1. นายไก่อายุ 20 ปี มีสิทธิรับบุตรบุญธรรมได้ เพราะบรรลุนิติภาวะแล้ว 2. การรับบุตรบุญธรรมที่ชอบด้วยกฎหมาย ไม่อาจกระทำเพียงการรับรองโดยพฤติการณ์ หากแต่ต้องดำเนินการจดทะเบียน 3. นายสิงห์จะรับนายเสือซึ่งมีอายุ 16 ปี เป็นบุตรบุญธรรม แม้บิดามารดาของนายเสือจะยินยอมและนายเสือยังไม่บรรลุนิติภาวะก็ตาม แต่ก็ต้องได้รับความยินยอมจากนายเสือด้วย 4. นายกาแฟอายุ 80 ปี สามารถรับนางชาอายุ 64 ปี เป็นบุตรบุญธรรมได้ เพราะนายกาแฟอายุแก่กว่านางชาเกิน 15 ปีแล้ว 5. บุตรบุญธรรมมีฐานะอย่างเดียวกับบุตรชอบด้วยกฎหมายของผู้รับบุตรบุญธรรม,1. นายไก่อายุ 20 ปี มีสิทธิรับบุตรบุญธรรมได้เพราะบรรลุนิติภาวะแล้ว,TRUE,TRUE,TRUE
2016,19,การกระทำใดเป็นนิติกรรมฝ่ายเดียว,1. นายดำทำพินัยกรรมยกที่ดินให้แก่นายแดง 2. นายขาวยกที่ดินให้แก่นายเขียวโดยเสน่หา 3. นายส้มตกลงขายที่ดินแก่นายแสด 4. นายม่วงทำสัญญากู้ยืมเงินนายมืด 5. นายน้ำตาลจำนำแหวนไว้กับนายน้ำตก,1. นายดำทำพินัยกรรมยกที่ดินให้แก่นายแดง,TRUE,TRUE,TRUE
2016,20,ข้อใดกล่าวถูกต้องเกี่ยวกับจำนำและจำนอง,1. จำนองต้องเป็นอสังหาริมทรัพย์เท่านั้น 2. การบังคับจำนำ ผู้รับจำนำทุกรายมีสิทธิเอาทรัพย์จำนำนั้นหลุดเป็นสิทธิแก่ตนได้ 3. การบังคับจำนอง ผู้รับจำนองต้องฟ้องร้องขอให้ศาลสั่งบังคับให้ หรือจะดำเนินการให้มีการขายทอดตลาดทรัพย์สินที่จำนองโดยไม่ต้องฟ้องเป็นคดีต่อศาลได้ในบางกรณี 4. ผู้จำนองต้องส่งมอบทรัพย์จำนองให้อยู่ในการครอบครองของผู้รับจำนองเพื่อเป็นหลักประกันการชำระหนี้ 5. การจำนองจะจดทะเบียนหรือไม่ก็ได้ แต่อย่างน้อยต้องมีหลักฐานเป็นหนังสือลงลายมือชื่อผู้จำนองกับผู้รับจำนองเป็นสำคัญ,3. การบังคับจำนอง ผู้รับจำนองต้องฟ้องร้อง ขอให้ศาลสั่งบังคับให้ หรือจะดำเนินการให้มี การขายทอดตลาดทรัพย์สินที่จำนองโดย ไม่ต้องฟ้องเป็นคดีต่อศาลได้ในบางกรณี,TRUE,TRUE,TRUE
2016,21,ข้อใดกล่าวถึงเรื่องหมั้นไม่ถูกต้อง,1. ชายและหญิงจะหมั้นกันได้ต่อเมื่อมีอายุ 17 ปี บริบูรณ์ขึ้นไปมิฉะนั้น การหมั้นจะตกเป็นโมฆะ 2. ผู้เยาว์จะทำการหมั้นได้ต่อเมื่อได้รับความยินยอมจากบิดามารดาหรือผู้ปกครองตามกฎหมาย มิฉะนั้น การหมั้นจะตกเป็นโมฆียะ 3. สิทธิในของหมั้นเป็นของหญิง ไม่ใช่สิทธิร่วมกันระหว่างชายหญิงคู่หมั้น 4. ของหมั้นต้องเป็นทรัพย์สินที่มีค่าตามสมควร ได้แก่ เครื่องประดับ เงิน ทองคำ อสังหาริมทรัพย์ 5. เมื่อการหมั้นมีผลสมบูรณ์ตามกฎหมาย หากคู่หมั้นฝ่ายใดผิดความตกลง คู่หมั้นอีกฝ่ายหนึ่งจะฟ้องให้ศาลสั่งให้มีการจดทะเบียนสมรสไม่ได้,4. ของหมั้นต้องเป็นทรัพย์สินที่มีค่าตาม สมควร ได้แก่ เครื่องประดับ เงิน ทองคำ อสังหาริมทรัพย์,TRUE,TRUE,TRUE
2016,22,ข้อใดไม่ใช่กฎหมายมหาชน,1. กฎหมายภาษีอากร 2. กฎหมายระหว่างประเทศ 3. กฎหมายประกันสังคม 4. กฎหมายส่งเสริมการลงทุน 5. กฎหมายมรดก,5. กฎหมายมรดก,TRUE,TRUE,TRUE
2016,23,ข้อใดกล่าวไม่ถูกต้องเกี่ยวกับเรื่องบุคคล,1. นิติบุคคลมีสิทธิและหน้าที่เหมือนกับบุคคลธรรมดาทุกประการ 2. สภาพบุคคลของบุคคลธรรมดาสิ้นสุดลงเมื่อตาย 3. บุคคลที่ไร้ความสามารถต้องเกิดจากการที่ศาลมีคำสั่งให้เป็นคนไร้ความสามารถเสมอ 4. นิติบุคคลถูกำหนดกรอบอำนาจหน้าที่ให้อยู่ในขอบวัตถุประสงค์ของนิติบุคคลนั้น ๆ 5. บุคคลซึ่งเป็นผู้เยาว์อาจบรรลุนิติภาวะได้ แม้อายุยังไม่ถึง 20 ปี,1. นิติบุคคลมีสิทธิและหน้าที่เหมือนกับ บุคคลธรรมดาทุกประการ,TRUE,TRUE,TRUE
2016,24,ข้อใดกล่าวไม่ถูกต้องเกี่ยวกับกฎหมายมรดก,"1. นายแสงมีทรัพย์สิน 10,000 บาท มีบุตร 1 คน คือ นางสาย นายแสงมีหนี้เงินกู้ต่อ นางสวยอยู่ 12,000 บาท เมื่อนายแสงตาย ทรัพย์สิน 10,000 บาทและหนี้เงินกู้ 12,000 บาท จะตกเป็นมรดกแก่นางสาย นางสายมีหน้าที่ต้องใช้เงินกู้แก่นางสวย แต่ไม่เกิน 10,000 บาทที่นางสายรับมา 2. นางพลอยเป็นผู้รับบุตรบุญธรรม มีนายเพชรเป็นบุตรบุญธรรม เมื่อนายเพชรตาย นางพลอยมีสิทธิรับมรดกทรัพย์สินที่เป็นของนายเพชรในฐานะทายาทโดยธรรม 3. นางหมอนเป็นบุตรบุญธรรมของนายมุ้ง เมื่อนายมุ้งตาย นางหมอนมีสิทธิรับมรดกทรัพย์สินที่เป็นของนายมุ้งในฐานะทายาทโดยธรรม 4. นายกล้าเป็นหลานของนายกุ๊ก โดยมีนายกุ๊กเป็นตา นายกล้าไม่มีคู่สมรสและบุตร นายกล้าทำพินัยกรรมให้นายกุ๊กเป็นผู้รับพินัยกรรมในทรัพย์สินของนายกล้า พินัยกรรมนี้มีผลสมบูรณ์ตามกฎหมายได้ เพราะผู้รับพินัยกรรมจะเป็นญาติหรือไม่ก็ได้ หรือจะเป็นทายาทโดยธรรมอยู่แล้วหรือไม่ก็ได้ 5. นายเดชเป็นบุตรบุญธรรมของนางดาวแล้ว ก็ยังมีสิทธิได้รับมรดกของนางเดือน และนายเดี่ยวซึ่งเป็นมารดาและบิดาของตนอยู่",2. นางพลอยเป็นผู้รับบุตรบุญธรรม มีนายเพชรเป็นบุตรบุญธรรม เมื่อนายเพชรตาย นางพลอยมีสิทธิรับมรดกทรัพย์สินที่เป็นของนายเพชรในฐานะทายาทโดยธรรม,TRUE,TRUE,TRUE
2016,25,สัญญาที่ทำด้วยวาจาโดยลำพังดังต่อไปนี้ สัญญาใดที่สามารถฟ้องร้องบังคับคดีต่อศาลได้,"1. สัญญาเช่าบ้าน อายุสัญญา 1 ปี อัตราค่าเช่าเดือนละ 5,000 บาท 2. สัญญากู้ยืมเงิน 3,000 บาท 3. สัญญาซื้อขายคอมพิวเตอร์ราคา 25,000 บาท 4. สัญญาจะซื้อจะขายที่ดินราคา 500,000 บาท 5. สัญญาเช่าเครื่องจักร อายุสัญญา 2 ปี อัตราค่าเช่าเดือนละ 100,000 บาท","5. สัญญาเช่าเครื่องจักร อายุสัญญา 2 ปี อัตราค่าเช่าเดือนละ 100,000 บาท",TRUE,TRUE,TRUE
2016,26,ข้อใดไม่ใช่องค์กรปกครองส่วนท้องถิ่น,1. องค์การบริหารส่วนตำบล 2. เทศบาลนคร 3. กรุงเทพมหานคร 4. เทศบาลเมือง 5. ตำบล,5. ตำบล,TRUE,TRUE,TRUE
